{
  "schema_version": "proof_bundle_plan_v0",
  "run_id": "ALPHA_RUN_20260415T100127Z",
  "task_class": "bounded_change",
  "governed_mode": "FULL_GOVERNED_PATH",
  "required_sections": [
    "final_result",
    "modified_files",
    "diff_provenance",
    "readback",
    "scenario_proof",
    "artifact_identity",
    "cleanup_status"
  ],
  "recommended_artifacts": {
    "final_result": "/private/tmp/synrail_alpha_pack_run_IkfbYi/project/.synrail/final_result.json",
    "readback": "/private/tmp/synrail_alpha_pack_run_IkfbYi/project/.synrail/readback.txt",
    "scenario_proof": "/private/tmp/synrail_alpha_pack_run_IkfbYi/project/.synrail/scenario.txt",
    "bundle_output": "/private/tmp/synrail_alpha_pack_run_IkfbYi/project/.synrail/bundle.json",
    "closure_output": "/private/tmp/synrail_alpha_pack_run_IkfbYi/project/.synrail/closure.json",
    "preparation_receipt_output": "/private/tmp/synrail_alpha_pack_run_IkfbYi/project/.synrail/preparation_receipt.json"
  },
  "artifact_identity": {
    "baseline_identity": "autodetected_generic_baseline",
    "execution_surface_identity": "autodetected_generic_worktree",
    "prompt_identity": "Reject a plain-text final result and keep the repair bounded.",
    "task_identity": "Reject a plain-text final result and keep the repair bounded."
  },
  "planning_status": "READY",
  "next_safe_step": "collect the planned proof artifacts and assemble the bundle before closure"
}
