{
  "schema_version": "proof_bundle_plan_v0",
  "run_id": "ALPHA_RUN_20260414T112716Z",
  "task_class": "bounded_change",
  "governed_mode": "FULL_GOVERNED_PATH",
  "required_sections": [
    "final_result",
    "modified_files",
    "diff_provenance",
    "readback",
    "scenario_proof",
    "artifact_identity",
    "cleanup_status"
  ],
  "recommended_artifacts": {
    "final_result": "/private/tmp/synrail_alpha_telemetry_001/final_result.json",
    "readback": "/private/tmp/synrail_alpha_telemetry_001/readback.txt",
    "scenario_proof": "/private/tmp/synrail_alpha_telemetry_001/scenario.txt",
    "bundle_output": "/private/tmp/synrail_alpha_telemetry_001/bundle.json",
    "closure_output": "/private/tmp/synrail_alpha_telemetry_001/closure.json",
    "preparation_receipt_output": "/private/tmp/synrail_alpha_telemetry_001/preparation_receipt.json"
  },
  "artifact_identity": {
    "baseline_identity": "trusted_clean",
    "execution_surface_identity": "clean-clone",
    "prompt_identity": "exact_prompt_v1",
    "task_identity": "exact_task_v1"
  },
  "planning_status": "READY",
  "next_safe_step": "collect the planned proof artifacts and assemble the bundle before closure"
}
